{
  "$schema": "https://raw.githubusercontent.com/Levdbas/groepenkaart-generator/main/schemas/groepenkaart-v5.schema.json",
  "schemaVersion": 5,
  "qrEnabled": true,
  "rcdEnabled": true,
  "phaseEnabled": true,
  "modules": [
    {
      "id": "eb0075b6-a809-4e7d-a5b2-b210cc05a135",
      "boxId": "67457a24-4b38-4c05-a842-f34abc2d3eee",
      "rail": 2,
      "slot": 9,
      "type": "RCD-4P",
      "number": "Geel",
      "description": "Gele Groepen",
      "characteristic": "",
      "phases": ["L1", "L2", "L3"],
      "protectedByModuleId": null,
      "name": "Gele Groepen",
      "color": "#FFC107"
    },
    {
      "id": "2a7e02fe-819e-453e-93e9-50472bd2fc2a",
      "boxId": "67457a24-4b38-4c05-a842-f34abc2d3eee",
      "rail": 2,
      "slot": 5,
      "type": "RCD-4P",
      "number": "Wit",
      "description": "Witte Groepen",
      "characteristic": "",
      "phases": ["L1", "L2", "L3"],
      "protectedByModuleId": null,
      "name": "Witte Groepen",
      "color": "#F8F9FA"
    },
    {
      "id": "9cf3d198-e53e-4529-9fbf-86a2a5b7c692",
      "boxId": "67457a24-4b38-4c05-a842-f34abc2d3eee",
      "rail": 1,
      "slot": 12,
      "type": "MCB",
      "number": "9",
      "description": "Combi Magnetron",
      "characteristic": "B",
      "phases": ["L1"],
      "protectedByModuleId": "eb0075b6-a809-4e7d-a5b2-b210cc05a135",
      "ratedCurrent": 16
    },
    {
      "id": "9ec74a1e-ef4f-470f-8bdf-d3e146fba04b",
      "boxId": "67457a24-4b38-4c05-a842-f34abc2d3eee",
      "rail": 1,
      "slot": 11,
      "type": "MCB",
      "number": "10",
      "description": "Stoom Oven",
      "characteristic": "B",
      "phases": ["L3"],
      "protectedByModuleId": "eb0075b6-a809-4e7d-a5b2-b210cc05a135",
      "ratedCurrent": 16
    },
    {
      "id": "fbf66d04-7d32-481e-b614-7052a5e714aa",
      "boxId": "67457a24-4b38-4c05-a842-f34abc2d3eee",
      "rail": 1,
      "slot": 10,
      "type": "MCB",
      "number": "11",
      "description": "Elektrische verwarming",
      "characteristic": "B",
      "phases": ["L2"],
      "protectedByModuleId": "eb0075b6-a809-4e7d-a5b2-b210cc05a135",
      "items": ["SL Kamers", "Verdiep", "Zolder"],
      "ratedCurrent": 16
    },
    {
      "id": "0e946b85-d109-416f-a8be-8f948b2bcc17",
      "boxId": "67457a24-4b38-4c05-a842-f34abc2d3eee",
      "rail": 1,
      "slot": 9,
      "type": "MCB",
      "number": "12",
      "description": "Voeding 230V Airco SLK 1",
      "characteristic": "B",
      "phases": ["L1"],
      "protectedByModuleId": "eb0075b6-a809-4e7d-a5b2-b210cc05a135",
      "ratedCurrent": 16
    },
    {
      "id": "9c397db7-138b-4dd8-af7f-1e83dcba75c4",
      "boxId": "67457a24-4b38-4c05-a842-f34abc2d3eee",
      "rail": 1,
      "slot": 7,
      "type": "RCBO-2P",
      "number": "13",
      "description": "Voeding 230V Patchkast (WCD)",
      "characteristic": "B",
      "phases": ["L1"],
      "protectedByModuleId": null,
      "items": ["Alamat"],
      "color": "#6C757D",
      "width": 2,
      "name": "Voeding 230V Patchkast (WCD)",
      "ratedCurrent": 16
    },
    {
      "id": "fc2ce11b-96a0-49aa-9766-acdf97e48dd2",
      "boxId": "67457a24-4b38-4c05-a842-f34abc2d3eee",
      "rail": 1,
      "slot": 5,
      "type": "MCB",
      "number": "14",
      "description": "Daikin Binnenunit 230V (B20)",
      "characteristic": "B",
      "phases": ["L3"],
      "protectedByModuleId": "2a7e02fe-819e-453e-93e9-50472bd2fc2a",
      "ratedCurrent": 20
    },
    {
      "id": "4595eb03-b3d0-4f31-91d4-d3ffcd6ddf05",
      "boxId": "67457a24-4b38-4c05-a842-f34abc2d3eee",
      "rail": 1,
      "slot": 4,
      "type": "MCB",
      "number": "15",
      "description": "Daikin Buitenunit 230V (B20)",
      "characteristic": "B",
      "phases": ["L2"],
      "protectedByModuleId": "2a7e02fe-819e-453e-93e9-50472bd2fc2a",
      "ratedCurrent": 20
    },
    {
      "id": "f9aafce9-9e0b-4cab-aec0-13ab950d17a3",
      "boxId": "67457a24-4b38-4c05-a842-f34abc2d3eee",
      "rail": 1,
      "slot": 1,
      "type": "OTHER",
      "number": "16",
      "description": "Kookplaat",
      "characteristic": "B",
      "phases": [],
      "protectedByModuleId": null,
      "width": 3,
      "ratedCurrent": 16
    },
    {
      "id": "2b451bea-4c25-4a65-b114-0cda918fca8f",
      "boxId": "8b97bcc6-6432-44cb-b733-8eb87042951d",
      "rail": 2,
      "slot": 1,
      "type": "RCD-4P",
      "number": "Blauw",
      "description": "Blauwe Groepen",
      "characteristic": "",
      "phases": ["L1", "L2", "L3"],
      "protectedByModuleId": null,
      "name": "Blauwe Groepen",
      "color": "#007BFF"
    },
    {
      "id": "5ed06e26-98db-4882-a543-d505b8a7333c",
      "boxId": "8b97bcc6-6432-44cb-b733-8eb87042951d",
      "rail": 2,
      "slot": 5,
      "type": "RCD-4P",
      "number": "Groen",
      "description": "Groene Groepen",
      "characteristic": "",
      "phases": ["L1", "L2", "L3"],
      "protectedByModuleId": null,
      "name": "Groene Groepen",
      "color": "#28A745"
    },
    {
      "id": "6ec29e8f-5416-4147-ba63-919de1d2695c",
      "boxId": "8b97bcc6-6432-44cb-b733-8eb87042951d",
      "rail": 1,
      "slot": 10,
      "type": "MCB",
      "number": "1",
      "description": "",
      "characteristic": "B",
      "phases": ["L1"],
      "protectedByModuleId": "5ed06e26-98db-4882-a543-d505b8a7333c",
      "items": [
        "Entree",
        "Toilet 1",
        "Overloop",
        "Badkamer",
        "Zolder",
        "Keukenblok"
      ],
      "ratedCurrent": 16
    },
    {
      "id": "64bc50d6-d7d5-4aaa-8e67-566b9ae589c5",
      "boxId": "8b97bcc6-6432-44cb-b733-8eb87042951d",
      "rail": 1,
      "slot": 9,
      "type": "MCB",
      "number": "2",
      "description": "Wasmachine",
      "characteristic": "B",
      "phases": ["L3"],
      "protectedByModuleId": "5ed06e26-98db-4882-a543-d505b8a7333c",
      "ratedCurrent": 16
    },
    {
      "id": "f6c6f784-211a-45d2-b1e0-765fd014f676",
      "boxId": "8b97bcc6-6432-44cb-b733-8eb87042951d",
      "rail": 1,
      "slot": 8,
      "type": "MCB",
      "number": "3",
      "description": "Wasdroger",
      "characteristic": "B",
      "phases": ["L2"],
      "protectedByModuleId": "5ed06e26-98db-4882-a543-d505b8a7333c",
      "ratedCurrent": 16
    },
    {
      "id": "fd5f8b76-b2d7-4251-b4b4-a8cd25839dd8",
      "boxId": "8b97bcc6-6432-44cb-b733-8eb87042951d",
      "rail": 1,
      "slot": 7,
      "type": "MCB",
      "number": "4",
      "description": "Eetkeuken, Berging",
      "characteristic": "B",
      "phases": ["L1"],
      "protectedByModuleId": "5ed06e26-98db-4882-a543-d505b8a7333c",
      "ratedCurrent": 16
    },
    {
      "id": "acad6953-93c3-495e-8352-0569ca611be4",
      "boxId": "8b97bcc6-6432-44cb-b733-8eb87042951d",
      "rail": 1,
      "slot": 6,
      "type": "MCB",
      "number": "5",
      "description": "Woonkamer, Eetkeuken",
      "characteristic": "B",
      "phases": ["L1"],
      "protectedByModuleId": "2b451bea-4c25-4a65-b114-0cda918fca8f",
      "ratedCurrent": 16
    },
    {
      "id": "fe7d07ed-5b31-48ca-b3a6-cbb8e7eaf6a9",
      "boxId": "8b97bcc6-6432-44cb-b733-8eb87042951d",
      "rail": 1,
      "slot": 5,
      "type": "MCB",
      "number": "6",
      "description": "Slaapkamer verdieping",
      "characteristic": "B",
      "phases": ["L3"],
      "protectedByModuleId": "2b451bea-4c25-4a65-b114-0cda918fca8f",
      "ratedCurrent": 16
    },
    {
      "id": "4682a8e3-c674-4372-aa19-debdac3794d5",
      "boxId": "8b97bcc6-6432-44cb-b733-8eb87042951d",
      "rail": 1,
      "slot": 4,
      "type": "MCB",
      "number": "7",
      "description": "Vaatwasmachine",
      "characteristic": "B",
      "phases": ["L2"],
      "protectedByModuleId": "2b451bea-4c25-4a65-b114-0cda918fca8f",
      "ratedCurrent": 16
    },
    {
      "id": "c2013cf4-efc9-425a-b30f-f81a90438438",
      "boxId": "8b97bcc6-6432-44cb-b733-8eb87042951d",
      "rail": 1,
      "slot": 3,
      "type": "MCB",
      "number": "8",
      "description": "Quooker",
      "characteristic": "B",
      "phases": ["L1"],
      "protectedByModuleId": "2b451bea-4c25-4a65-b114-0cda918fca8f",
      "ratedCurrent": 16
    },
    {
      "id": "02be3c95-d83f-4321-a990-1de1f2caa0df",
      "boxId": "f14c2a3a-7458-4024-848c-d065efe124cc",
      "rail": 2,
      "slot": 9,
      "type": "RCD-4P",
      "number": "A",
      "description": "Aardlek Rechterkast",
      "characteristic": "",
      "phases": ["L1", "L2", "L3"],
      "protectedByModuleId": null,
      "name": "Aardlek Rechterkast",
      "color": "#DC3545"
    },
    {
      "id": "54b5aeaa-0357-48ec-adb0-d5a4052b2f2d",
      "boxId": "f14c2a3a-7458-4024-848c-d065efe124cc",
      "rail": 1,
      "slot": 9,
      "type": "MCB-3P",
      "number": "16",
      "description": "Laadpaal auto",
      "characteristic": "B",
      "phases": ["L1", "L2", "L3"],
      "protectedByModuleId": "02be3c95-d83f-4321-a990-1de1f2caa0df",
      "warnings": ["ev"],
      "ratedCurrent": 25
    },
    {
      "id": "2c3398fa-5b1f-4f84-b8bf-7d0b10428bb0",
      "boxId": "f14c2a3a-7458-4024-848c-d065efe124cc",
      "rail": 1,
      "slot": 7,
      "type": "MCB",
      "number": "17",
      "description": "Extra groep 1",
      "characteristic": "B",
      "phases": ["L1"],
      "protectedByModuleId": "02be3c95-d83f-4321-a990-1de1f2caa0df",
      "ratedCurrent": 16
    },
    {
      "id": "3de202ab-8dfa-4035-9e98-cef8ff674c55",
      "boxId": "f14c2a3a-7458-4024-848c-d065efe124cc",
      "rail": 1,
      "slot": 8,
      "type": "MCB",
      "number": "18",
      "description": "Extra groep 2",
      "characteristic": "B",
      "phases": ["L1"],
      "protectedByModuleId": "02be3c95-d83f-4321-a990-1de1f2caa0df",
      "ratedCurrent": 16
    },
    {
      "id": "45039c3b-2893-4289-adf7-aa8f44886d5c",
      "boxId": "8b97bcc6-6432-44cb-b733-8eb87042951d",
      "rail": 1,
      "slot": 2,
      "type": "MCB",